productId,productName,productDescription,productDiscountedPrice,productActualPrice,productCategory,productStock,productImageLink
50,Black Sofa,A black Colored Sofa,50000,55000,Sofas & Beds,52,black-sofa.jfif
51,Japanese Dining Table,A japanese styled dining table,18000,20000,Dining Table,20,japanese-style-dining-table.jpg
52,Bed With Drawer, A Bed with drawer,48000,50000,Beds,15,be-with-drawer.jpg
53,Cross X Brown Wooden Shelves,A shelve which is of brown color in the cross shape,23000,25000,Bookcases & Shelving Units,20,cross-book-rack.jpg
54,Wooden Tv Stand,A well furnished wooden tv unit,15999,17999,TV & Media Furniture,23,wooden-tv-stand
55,table,A well furnished wooden tv unit,15999,17999,table,23,cross-book-rack.jpg
